{
  "contractId": "hardware-contract-1",
  "generation": 1,
  "observed": {},
  "participant": "controller:controller-main",
  "refreshSeq": 1,
  "schema": "dev.deckr.concord.participant-token.v1",
  "sessionId": "controller-session",
  "termsHash": "sha256:53e9478a8975871368eaf33b31c3980da70d68992ccc3d750799289848df7113",
  "tokenId": "controller-token-1",
  "ttlSeconds": 30
}
